SQL> 
SQL> REM DML STATEMENTS : 1 INSERT 2 UPDATE 3 DELETE
SQL> 
SQL> REM UPDATE : TO UPDATE/MODIFY/CHANGE/EDIT EXISTING ROW VALUES/DATA
SQL> 
SQL> DROP TABLE E1;

Table dropped.

SQL> CREATE TABLE E1 AS SELECT * FROM EMPLOYEES;

Table created.

SQL> SELECT * FROM E1;

EMPLOYEE_ID FIRST_NAME      LAST_NAME       EMAIL      PHONE_NUMBER         HIRE_DATE JOB_ID         SALARY COMMISSION_PCT MANAGER_ID DEPARTMENT_ID                                                     
----------- --------------- --------------- ---------- -------------------- --------- ---------- ---------- -------------- ---------- -------------                                                     
        100 Steven          King            SKING      515.123.4567         17-JUL-87 AD_PRES         24000                                      90                                                     
        101 Neena           Kochhar         NKOCHHAR   515.123.4568         21-SEP-89 AD_VP           17000                       100            90                                                     
        102 Lex             De Haan         LDEHAAN    515.123.4569         13-JAN-93 AD_VP           17000                       100            90                                                     
        103 Alexander       Hunold          AHUNOLD    590.423.4567         03-JAN-90 IT_PROG          9000                       102            60                                                     
        104 Bruce           Ernst           BERNST     590.423.4568         21-MAY-91 IT_PROG          6000                       103            60                                                     
        107 Diana           Lorentz         DLORENTZ   590.423.5567         07-FEB-99 IT_PROG          4200                       103            60                                                     
        124 Kevin           Mourgos         KMOURGOS   650.123.5234         16-NOV-99 ST_MAN           5800                       100            50                                                     
        141 Trenna          Rajs            TRAJS      650.121.8009         17-OCT-95 ST_CLERK         3500                       124            50                                                     
        142 Curtis          Davies          CDAVIES    650.121.2994         29-JAN-97 ST_CLERK         3100                       124            50                                                     
        143 Randall         Matos           RMATOS     650.121.2874         15-MAR-98 ST_CLERK         2600                       124            50                                                     
        144 Peter           Vargas                     650.121.2004         09-JUL-98 ST_CLERK         2500                       124            50                                                     
        149 Eleni           Zlotkey         EZLOTKEY   011.44.1344.429018   29-JAN-00 SA_MAN          10500             .2        100            80                                                     
        174 Ellen           Abel            EABEL      011.44.1644.429267   11-MAY-96 SA_REP          11000             .3        149            80                                                     
        176 Jonathon        Taylor          JTAYLOR    011.44.1644.429265   24-MAR-98 SA_REP           8600             .3        149            80                                                     
        178 Kimerely        Grant           KGRANT     011.44.1644.429263   24-MAY-99 SA_REP           7000            .15        149                                                                   
        200 Jennifer        Whalen          JWHALEN    515.123.4444         17-SEP-87 AD_ASST          4400                       101            10                                                     
        201 Michael         Hartstein       MHARTSTE   515.123.5555         17-FEB-96 MK_MAN          13000                       100            20                                                     
        202 Pat             Fay             PFAY       603.123.6666         17-AUG-97 MK_REP           6000                       201            20                                                     
        205 Shelley         Higgins         SHIGGINS   515.123.8080         07-JUN-94 AC_MGR          12000                       101           110                                                     
        206 William         Gietz           WGIETZ     515.123.8181         07-JUN-94 AC_ACCOUNT       8300                       205           110                                                     

20 rows selected.

SQL> REM COMPANY ANNOUNCE +1000 INCREMENT FOR EMPLOYEES 176
SQL> 
SQL> REM UPDATE SYNTAX : UPDATE tablename SET columnname = value , ... WHERE condition(s);
SQL> 
SQL> UPDATE E1 SET SALARY = SALARY + 1000;

20 rows updated.

SQL> SELECT * FROM E1;

EMPLOYEE_ID FIRST_NAME      LAST_NAME       EMAIL      PHONE_NUMBER         HIRE_DATE JOB_ID         SALARY COMMISSION_PCT MANAGER_ID DEPARTMENT_ID                                                     
----------- --------------- --------------- ---------- -------------------- --------- ---------- ---------- -------------- ---------- -------------                                                     
        100 Steven          King            SKING      515.123.4567         17-JUL-87 AD_PRES         25000                                      90                                                     
        101 Neena           Kochhar         NKOCHHAR   515.123.4568         21-SEP-89 AD_VP           18000                       100            90                                                     
        102 Lex             De Haan         LDEHAAN    515.123.4569         13-JAN-93 AD_VP           18000                       100            90                                                     
        103 Alexander       Hunold          AHUNOLD    590.423.4567         03-JAN-90 IT_PROG         10000                       102            60                                                     
        104 Bruce           Ernst           BERNST     590.423.4568         21-MAY-91 IT_PROG          7000                       103            60                                                     
        107 Diana           Lorentz         DLORENTZ   590.423.5567         07-FEB-99 IT_PROG          5200                       103            60                                                     
        124 Kevin           Mourgos         KMOURGOS   650.123.5234         16-NOV-99 ST_MAN           6800                       100            50                                                     
        141 Trenna          Rajs            TRAJS      650.121.8009         17-OCT-95 ST_CLERK         4500                       124            50                                                     
        142 Curtis          Davies          CDAVIES    650.121.2994         29-JAN-97 ST_CLERK         4100                       124            50                                                     
        143 Randall         Matos           RMATOS     650.121.2874         15-MAR-98 ST_CLERK         3600                       124            50                                                     
        144 Peter           Vargas                     650.121.2004         09-JUL-98 ST_CLERK         3500                       124            50                                                     
        149 Eleni           Zlotkey         EZLOTKEY   011.44.1344.429018   29-JAN-00 SA_MAN          11500             .2        100            80                                                     
        174 Ellen           Abel            EABEL      011.44.1644.429267   11-MAY-96 SA_REP          12000             .3        149            80                                                     
        176 Jonathon        Taylor          JTAYLOR    011.44.1644.429265   24-MAR-98 SA_REP           9600             .3        149            80                                                     
        178 Kimerely        Grant           KGRANT     011.44.1644.429263   24-MAY-99 SA_REP           8000            .15        149                                                                   
        200 Jennifer        Whalen          JWHALEN    515.123.4444         17-SEP-87 AD_ASST          5400                       101            10                                                     
        201 Michael         Hartstein       MHARTSTE   515.123.5555         17-FEB-96 MK_MAN          14000                       100            20                                                     
        202 Pat             Fay             PFAY       603.123.6666         17-AUG-97 MK_REP           7000                       201            20                                                     
        205 Shelley         Higgins         SHIGGINS   515.123.8080         07-JUN-94 AC_MGR          13000                       101           110                                                     
        206 William         Gietz           WGIETZ     515.123.8181         07-JUN-94 AC_ACCOUNT       9300                       205           110                                                     

20 rows selected.

SQL> ROLLBACK;

Rollback complete.

SQL> SELECT * FROM E1;

EMPLOYEE_ID FIRST_NAME      LAST_NAME       EMAIL      PHONE_NUMBER         HIRE_DATE JOB_ID         SALARY COMMISSION_PCT MANAGER_ID DEPARTMENT_ID                                                     
----------- --------------- --------------- ---------- -------------------- --------- ---------- ---------- -------------- ---------- -------------                                                     
        100 Steven          King            SKING      515.123.4567         17-JUL-87 AD_PRES         24000                                      90                                                     
        101 Neena           Kochhar         NKOCHHAR   515.123.4568         21-SEP-89 AD_VP           17000                       100            90                                                     
        102 Lex             De Haan         LDEHAAN    515.123.4569         13-JAN-93 AD_VP           17000                       100            90                                                     
        103 Alexander       Hunold          AHUNOLD    590.423.4567         03-JAN-90 IT_PROG          9000                       102            60                                                     
        104 Bruce           Ernst           BERNST     590.423.4568         21-MAY-91 IT_PROG          6000                       103            60                                                     
        107 Diana           Lorentz         DLORENTZ   590.423.5567         07-FEB-99 IT_PROG          4200                       103            60                                                     
        124 Kevin           Mourgos         KMOURGOS   650.123.5234         16-NOV-99 ST_MAN           5800                       100            50                                                     
        141 Trenna          Rajs            TRAJS      650.121.8009         17-OCT-95 ST_CLERK         3500                       124            50                                                     
        142 Curtis          Davies          CDAVIES    650.121.2994         29-JAN-97 ST_CLERK         3100                       124            50                                                     
        143 Randall         Matos           RMATOS     650.121.2874         15-MAR-98 ST_CLERK         2600                       124            50                                                     
        144 Peter           Vargas                     650.121.2004         09-JUL-98 ST_CLERK         2500                       124            50                                                     
        149 Eleni           Zlotkey         EZLOTKEY   011.44.1344.429018   29-JAN-00 SA_MAN          10500             .2        100            80                                                     
        174 Ellen           Abel            EABEL      011.44.1644.429267   11-MAY-96 SA_REP          11000             .3        149            80                                                     
        176 Jonathon        Taylor          JTAYLOR    011.44.1644.429265   24-MAR-98 SA_REP           8600             .3        149            80                                                     
        178 Kimerely        Grant           KGRANT     011.44.1644.429263   24-MAY-99 SA_REP           7000            .15        149                                                                   
        200 Jennifer        Whalen          JWHALEN    515.123.4444         17-SEP-87 AD_ASST          4400                       101            10                                                     
        201 Michael         Hartstein       MHARTSTE   515.123.5555         17-FEB-96 MK_MAN          13000                       100            20                                                     
        202 Pat             Fay             PFAY       603.123.6666         17-AUG-97 MK_REP           6000                       201            20                                                     
        205 Shelley         Higgins         SHIGGINS   515.123.8080         07-JUN-94 AC_MGR          12000                       101           110                                                     
        206 William         Gietz           WGIETZ     515.123.8181         07-JUN-94 AC_ACCOUNT       8300                       205           110                                                     

20 rows selected.

SQL> UPDATE E1 SET SALARY = SALARY + 1000 WHERE EMPLOYEE_ID = 176;

1 row updated.

SQL> SELECT * FROM E1;

EMPLOYEE_ID FIRST_NAME      LAST_NAME       EMAIL      PHONE_NUMBER         HIRE_DATE JOB_ID         SALARY COMMISSION_PCT MANAGER_ID DEPARTMENT_ID                                                     
----------- --------------- --------------- ---------- -------------------- --------- ---------- ---------- -------------- ---------- -------------                                                     
        100 Steven          King            SKING      515.123.4567         17-JUL-87 AD_PRES         24000                                      90                                                     
        101 Neena           Kochhar         NKOCHHAR   515.123.4568         21-SEP-89 AD_VP           17000                       100            90                                                     
        102 Lex             De Haan         LDEHAAN    515.123.4569         13-JAN-93 AD_VP           17000                       100            90                                                     
        103 Alexander       Hunold          AHUNOLD    590.423.4567         03-JAN-90 IT_PROG          9000                       102            60                                                     
        104 Bruce           Ernst           BERNST     590.423.4568         21-MAY-91 IT_PROG          6000                       103            60                                                     
        107 Diana           Lorentz         DLORENTZ   590.423.5567         07-FEB-99 IT_PROG          4200                       103            60                                                     
        124 Kevin           Mourgos         KMOURGOS   650.123.5234         16-NOV-99 ST_MAN           5800                       100            50                                                     
        141 Trenna          Rajs            TRAJS      650.121.8009         17-OCT-95 ST_CLERK         3500                       124            50                                                     
        142 Curtis          Davies          CDAVIES    650.121.2994         29-JAN-97 ST_CLERK         3100                       124            50                                                     
        143 Randall         Matos           RMATOS     650.121.2874         15-MAR-98 ST_CLERK         2600                       124            50                                                     
        144 Peter           Vargas                     650.121.2004         09-JUL-98 ST_CLERK         2500                       124            50                                                     
        149 Eleni           Zlotkey         EZLOTKEY   011.44.1344.429018   29-JAN-00 SA_MAN          10500             .2        100            80                                                     
        174 Ellen           Abel            EABEL      011.44.1644.429267   11-MAY-96 SA_REP          11000             .3        149            80                                                     
        176 Jonathon        Taylor          JTAYLOR    011.44.1644.429265   24-MAR-98 SA_REP           9600             .3        149            80                                                     
        178 Kimerely        Grant           KGRANT     011.44.1644.429263   24-MAY-99 SA_REP           7000            .15        149                                                                   
        200 Jennifer        Whalen          JWHALEN    515.123.4444         17-SEP-87 AD_ASST          4400                       101            10                                                     
        201 Michael         Hartstein       MHARTSTE   515.123.5555         17-FEB-96 MK_MAN          13000                       100            20                                                     
        202 Pat             Fay             PFAY       603.123.6666         17-AUG-97 MK_REP           6000                       201            20                                                     
        205 Shelley         Higgins         SHIGGINS   515.123.8080         07-JUN-94 AC_MGR          12000                       101           110                                                     
        206 William         Gietz           WGIETZ     515.123.8181         07-JUN-94 AC_ACCOUNT       8300                       205           110                                                     

20 rows selected.

SQL> REM COMPANY ANNOUNCE 20% INCREMENT FOR IT_PROG
SQL> 
SQL> UPDATE E1 SET SALARY = SALARY * 1.2 WHERE JOB_ID = 'IT_PROG';

3 rows updated.

SQL> SELECT * FROM E1;

EMPLOYEE_ID FIRST_NAME      LAST_NAME       EMAIL      PHONE_NUMBER         HIRE_DATE JOB_ID         SALARY COMMISSION_PCT MANAGER_ID DEPARTMENT_ID                                                     
----------- --------------- --------------- ---------- -------------------- --------- ---------- ---------- -------------- ---------- -------------                                                     
        100 Steven          King            SKING      515.123.4567         17-JUL-87 AD_PRES         24000                                      90                                                     
        101 Neena           Kochhar         NKOCHHAR   515.123.4568         21-SEP-89 AD_VP           17000                       100            90                                                     
        102 Lex             De Haan         LDEHAAN    515.123.4569         13-JAN-93 AD_VP           17000                       100            90                                                     
        103 Alexander       Hunold          AHUNOLD    590.423.4567         03-JAN-90 IT_PROG         10800                       102            60                                                     
        104 Bruce           Ernst           BERNST     590.423.4568         21-MAY-91 IT_PROG          7200                       103            60                                                     
        107 Diana           Lorentz         DLORENTZ   590.423.5567         07-FEB-99 IT_PROG          5040                       103            60                                                     
        124 Kevin           Mourgos         KMOURGOS   650.123.5234         16-NOV-99 ST_MAN           5800                       100            50                                                     
        141 Trenna          Rajs            TRAJS      650.121.8009         17-OCT-95 ST_CLERK         3500                       124            50                                                     
        142 Curtis          Davies          CDAVIES    650.121.2994         29-JAN-97 ST_CLERK         3100                       124            50                                                     
        143 Randall         Matos           RMATOS     650.121.2874         15-MAR-98 ST_CLERK         2600                       124            50                                                     
        144 Peter           Vargas                     650.121.2004         09-JUL-98 ST_CLERK         2500                       124            50                                                     
        149 Eleni           Zlotkey         EZLOTKEY   011.44.1344.429018   29-JAN-00 SA_MAN          10500             .2        100            80                                                     
        174 Ellen           Abel            EABEL      011.44.1644.429267   11-MAY-96 SA_REP          11000             .3        149            80                                                     
        176 Jonathon        Taylor          JTAYLOR    011.44.1644.429265   24-MAR-98 SA_REP           9600             .3        149            80                                                     
        178 Kimerely        Grant           KGRANT     011.44.1644.429263   24-MAY-99 SA_REP           7000            .15        149                                                                   
        200 Jennifer        Whalen          JWHALEN    515.123.4444         17-SEP-87 AD_ASST          4400                       101            10                                                     
        201 Michael         Hartstein       MHARTSTE   515.123.5555         17-FEB-96 MK_MAN          13000                       100            20                                                     
        202 Pat             Fay             PFAY       603.123.6666         17-AUG-97 MK_REP           6000                       201            20                                                     
        205 Shelley         Higgins         SHIGGINS   515.123.8080         07-JUN-94 AC_MGR          12000                       101           110                                                     
        206 William         Gietz           WGIETZ     515.123.8181         07-JUN-94 AC_ACCOUNT       8300                       205           110                                                     

20 rows selected.

SQL> REM COMPANY PROMOTES EMPLOYEE 143 TO SA_REP WITH +1000 INCREMENT.
SQL> 
SQL> UPDATE E1 SET JOB_ID = 'SA_REP' , SALARY = SALARY + 1000 WHERE EMPLOYEE_ID = 143;

1 row updated.

SQL> SELECT * FROM E1;

EMPLOYEE_ID FIRST_NAME      LAST_NAME       EMAIL      PHONE_NUMBER         HIRE_DATE JOB_ID         SALARY COMMISSION_PCT MANAGER_ID DEPARTMENT_ID                                                     
----------- --------------- --------------- ---------- -------------------- --------- ---------- ---------- -------------- ---------- -------------                                                     
        100 Steven          King            SKING      515.123.4567         17-JUL-87 AD_PRES         24000                                      90                                                     
        101 Neena           Kochhar         NKOCHHAR   515.123.4568         21-SEP-89 AD_VP           17000                       100            90                                                     
        102 Lex             De Haan         LDEHAAN    515.123.4569         13-JAN-93 AD_VP           17000                       100            90                                                     
        103 Alexander       Hunold          AHUNOLD    590.423.4567         03-JAN-90 IT_PROG         10800                       102            60                                                     
        104 Bruce           Ernst           BERNST     590.423.4568         21-MAY-91 IT_PROG          7200                       103            60                                                     
        107 Diana           Lorentz         DLORENTZ   590.423.5567         07-FEB-99 IT_PROG          5040                       103            60                                                     
        124 Kevin           Mourgos         KMOURGOS   650.123.5234         16-NOV-99 ST_MAN           5800                       100            50                                                     
        141 Trenna          Rajs            TRAJS      650.121.8009         17-OCT-95 ST_CLERK         3500                       124            50                                                     
        142 Curtis          Davies          CDAVIES    650.121.2994         29-JAN-97 ST_CLERK         3100                       124            50                                                     
        143 Randall         Matos           RMATOS     650.121.2874         15-MAR-98 SA_REP           3600                       124            50                                                     
        144 Peter           Vargas                     650.121.2004         09-JUL-98 ST_CLERK         2500                       124            50                                                     
        149 Eleni           Zlotkey         EZLOTKEY   011.44.1344.429018   29-JAN-00 SA_MAN          10500             .2        100            80                                                     
        174 Ellen           Abel            EABEL      011.44.1644.429267   11-MAY-96 SA_REP          11000             .3        149            80                                                     
        176 Jonathon        Taylor          JTAYLOR    011.44.1644.429265   24-MAR-98 SA_REP           9600             .3        149            80                                                     
        178 Kimerely        Grant           KGRANT     011.44.1644.429263   24-MAY-99 SA_REP           7000            .15        149                                                                   
        200 Jennifer        Whalen          JWHALEN    515.123.4444         17-SEP-87 AD_ASST          4400                       101            10                                                     
        201 Michael         Hartstein       MHARTSTE   515.123.5555         17-FEB-96 MK_MAN          13000                       100            20                                                     
        202 Pat             Fay             PFAY       603.123.6666         17-AUG-97 MK_REP           6000                       201            20                                                     
        205 Shelley         Higgins         SHIGGINS   515.123.8080         07-JUN-94 AC_MGR          12000                       101           110                                                     
        206 William         Gietz           WGIETZ     515.123.8181         07-JUN-94 AC_ACCOUNT       8300                       205           110                                                     

20 rows selected.

SQL> REM COMPANY INFORMS EMPLOYEES 174 TO REPORT EMPLOYEE 103 FROM TODAY ONWARDS.
SQL> 
SQL> UPDATE E1 SET MANAGER_ID = 103 WHERE EMPLOYEE_ID = 174;

1 row updated.

SQL> REM EMPLOYEES OF DEPARTMENT 60 ARE MERGED TO DEPARTMENT 80.
SQL> 
SQL> UPDATE E1 SET DEPARTMENT_ID = 80 WHERE DEPARTMENT_ID = 60;

3 rows updated.

SQL> REM COMPANY ANNOUNCE 50% INCREMENT FOR THOSE WHO WERE HIRED IN 3rd QUARTER OF ANY YEAR
SQL> 
SQL> UPDATE E1 SET SALARY = SALARY * 1.5 WHERE TO_CHAR(HIRE_DATE,'Q') = 3;

5 rows updated.

SQL> REM COMANY ANNOUNT 20% INCREMENT FOR Marketing DEPARTMENT
SQL> 
SQL> SELECT * FROM E1;

EMPLOYEE_ID FIRST_NAME      LAST_NAME       EMAIL      PHONE_NUMBER         HIRE_DATE JOB_ID         SALARY COMMISSION_PCT MANAGER_ID DEPARTMENT_ID                                                     
----------- --------------- --------------- ---------- -------------------- --------- ---------- ---------- -------------- ---------- -------------                                                     
        100 Steven          King            SKING      515.123.4567         17-JUL-87 AD_PRES         36000                                      90                                                     
        101 Neena           Kochhar         NKOCHHAR   515.123.4568         21-SEP-89 AD_VP           25500                       100            90                                                     
        102 Lex             De Haan         LDEHAAN    515.123.4569         13-JAN-93 AD_VP           17000                       100            90                                                     
        103 Alexander       Hunold          AHUNOLD    590.423.4567         03-JAN-90 IT_PROG         10800                       102            80                                                     
        104 Bruce           Ernst           BERNST     590.423.4568         21-MAY-91 IT_PROG          7200                       103            80                                                     
        107 Diana           Lorentz         DLORENTZ   590.423.5567         07-FEB-99 IT_PROG          5040                       103            80                                                     
        124 Kevin           Mourgos         KMOURGOS   650.123.5234         16-NOV-99 ST_MAN           5800                       100            50                                                     
        141 Trenna          Rajs            TRAJS      650.121.8009         17-OCT-95 ST_CLERK         3500                       124            50                                                     
        142 Curtis          Davies          CDAVIES    650.121.2994         29-JAN-97 ST_CLERK         3100                       124            50                                                     
        143 Randall         Matos           RMATOS     650.121.2874         15-MAR-98 SA_REP           3600                       124            50                                                     
        144 Peter           Vargas                     650.121.2004         09-JUL-98 ST_CLERK         3750                       124            50                                                     
        149 Eleni           Zlotkey         EZLOTKEY   011.44.1344.429018   29-JAN-00 SA_MAN          10500             .2        100            80                                                     
        174 Ellen           Abel            EABEL      011.44.1644.429267   11-MAY-96 SA_REP          11000             .3        103            80                                                     
        176 Jonathon        Taylor          JTAYLOR    011.44.1644.429265   24-MAR-98 SA_REP           9600             .3        149            80                                                     
        178 Kimerely        Grant           KGRANT     011.44.1644.429263   24-MAY-99 SA_REP           7000            .15        149                                                                   
        200 Jennifer        Whalen          JWHALEN    515.123.4444         17-SEP-87 AD_ASST          6600                       101            10                                                     
        201 Michael         Hartstein       MHARTSTE   515.123.5555         17-FEB-96 MK_MAN          13000                       100            20                                                     
        202 Pat             Fay             PFAY       603.123.6666         17-AUG-97 MK_REP           9000                       201            20                                                     
        205 Shelley         Higgins         SHIGGINS   515.123.8080         07-JUN-94 AC_MGR          12000                       101           110                                                     
        206 William         Gietz           WGIETZ     515.123.8181         07-JUN-94 AC_ACCOUNT       8300                       205           110                                                     

20 rows selected.

SQL> SELECT * FROM DEPARTMENTS;

DEPARTMENT_ID DEPARTMENT_NAME                MANAGER_ID LOCATION_ID                                                                                                                                     
------------- ------------------------------ ---------- -----------                                                                                                                                     
           10 Administration                        200        1700                                                                                                                                     
           20 Marketing                             201        1800                                                                                                                                     
           50 Shiping                               124        1500                                                                                                                                     
           60 IT                                    103        1400                                                                                                                                     
           80 Sales                                 149        2500                                                                                                                                     
           90 Executive                             100        1700                                                                                                                                     
          110 Accounting                            205        1700                                                                                                                                     
          190 Contracting                                      1700                                                                                                                                     

8 rows selected.

SQL> UPDATE E1 SET SALARY = SALARY * 1.2 WHERE DEPARTMENT_ID IN (SELECT DEPARTMENT_ID FROM DEPARTMENTS WHERE DEPARTMENT_NAME = 'Marketing');

2 rows updated.

SQL> REM COMPANY INFORMS EMPLOYEES 206 TO REPORT Steven FROM TODAY ONWARDS.
SQL> 
SQL> UPDATE E1 SET MANAGER_ID = (SELECT EMPLOYEE_ID FROM E1 WHERE FIRST_NAME = 'Steven') WHERE EMPLOYEE_ID = 206;

1 row updated.

SQL> SELECT * FROM E1;

EMPLOYEE_ID FIRST_NAME      LAST_NAME       EMAIL      PHONE_NUMBER         HIRE_DATE JOB_ID         SALARY COMMISSION_PCT MANAGER_ID DEPARTMENT_ID                                                     
----------- --------------- --------------- ---------- -------------------- --------- ---------- ---------- -------------- ---------- -------------                                                     
        100 Steven          King            SKING      515.123.4567         17-JUL-87 AD_PRES         36000                                      90                                                     
        101 Neena           Kochhar         NKOCHHAR   515.123.4568         21-SEP-89 AD_VP           25500                       100            90                                                     
        102 Lex             De Haan         LDEHAAN    515.123.4569         13-JAN-93 AD_VP           17000                       100            90                                                     
        103 Alexander       Hunold          AHUNOLD    590.423.4567         03-JAN-90 IT_PROG         10800                       102            80                                                     
        104 Bruce           Ernst           BERNST     590.423.4568         21-MAY-91 IT_PROG          7200                       103            80                                                     
        107 Diana           Lorentz         DLORENTZ   590.423.5567         07-FEB-99 IT_PROG          5040                       103            80                                                     
        124 Kevin           Mourgos         KMOURGOS   650.123.5234         16-NOV-99 ST_MAN           5800                       100            50                                                     
        141 Trenna          Rajs            TRAJS      650.121.8009         17-OCT-95 ST_CLERK         3500                       124            50                                                     
        142 Curtis          Davies          CDAVIES    650.121.2994         29-JAN-97 ST_CLERK         3100                       124            50                                                     
        143 Randall         Matos           RMATOS     650.121.2874         15-MAR-98 SA_REP           3600                       124            50                                                     
        144 Peter           Vargas                     650.121.2004         09-JUL-98 ST_CLERK         3750                       124            50                                                     
        149 Eleni           Zlotkey         EZLOTKEY   011.44.1344.429018   29-JAN-00 SA_MAN          10500             .2        100            80                                                     
        174 Ellen           Abel            EABEL      011.44.1644.429267   11-MAY-96 SA_REP          11000             .3        103            80                                                     
        176 Jonathon        Taylor          JTAYLOR    011.44.1644.429265   24-MAR-98 SA_REP           9600             .3        149            80                                                     
        178 Kimerely        Grant           KGRANT     011.44.1644.429263   24-MAY-99 SA_REP           7000            .15        149                                                                   
        200 Jennifer        Whalen          JWHALEN    515.123.4444         17-SEP-87 AD_ASST          6600                       101            10                                                     
        201 Michael         Hartstein       MHARTSTE   515.123.5555         17-FEB-96 MK_MAN          15600                       100            20                                                     
        202 Pat             Fay             PFAY       603.123.6666         17-AUG-97 MK_REP          10800                       201            20                                                     
        205 Shelley         Higgins         SHIGGINS   515.123.8080         07-JUN-94 AC_MGR          12000                       101           110                                                     
        206 William         Gietz           WGIETZ     515.123.8181         07-JUN-94 AC_ACCOUNT       8300                       100           110                                                     

20 rows selected.

SQL> REM COMPANY PROMOTS William TO THE SAME POSITION AND SALARY WHICH EMPLOYEE Ellen HOLDS.
SQL> 
SQL> UPDATE E1 SET (JOB_ID , SALARY) = (SELECT JOB_ID , SALARY FROM E1 WHERE FIRST_NAME = 'Ellen') WHERE FIRST_NAME = 'William';

1 row updated.

SQL> SELECT * FROM E1;

EMPLOYEE_ID FIRST_NAME      LAST_NAME       EMAIL      PHONE_NUMBER         HIRE_DATE JOB_ID         SALARY COMMISSION_PCT MANAGER_ID DEPARTMENT_ID                                                     
----------- --------------- --------------- ---------- -------------------- --------- ---------- ---------- -------------- ---------- -------------                                                     
        100 Steven          King            SKING      515.123.4567         17-JUL-87 AD_PRES         36000                                      90                                                     
        101 Neena           Kochhar         NKOCHHAR   515.123.4568         21-SEP-89 AD_VP           25500                       100            90                                                     
        102 Lex             De Haan         LDEHAAN    515.123.4569         13-JAN-93 AD_VP           17000                       100            90                                                     
        103 Alexander       Hunold          AHUNOLD    590.423.4567         03-JAN-90 IT_PROG         10800                       102            80                                                     
        104 Bruce           Ernst           BERNST     590.423.4568         21-MAY-91 IT_PROG          7200                       103            80                                                     
        107 Diana           Lorentz         DLORENTZ   590.423.5567         07-FEB-99 IT_PROG          5040                       103            80                                                     
        124 Kevin           Mourgos         KMOURGOS   650.123.5234         16-NOV-99 ST_MAN           5800                       100            50                                                     
        141 Trenna          Rajs            TRAJS      650.121.8009         17-OCT-95 ST_CLERK         3500                       124            50                                                     
        142 Curtis          Davies          CDAVIES    650.121.2994         29-JAN-97 ST_CLERK         3100                       124            50                                                     
        143 Randall         Matos           RMATOS     650.121.2874         15-MAR-98 SA_REP           3600                       124            50                                                     
        144 Peter           Vargas                     650.121.2004         09-JUL-98 ST_CLERK         3750                       124            50                                                     
        149 Eleni           Zlotkey         EZLOTKEY   011.44.1344.429018   29-JAN-00 SA_MAN          10500             .2        100            80                                                     
        174 Ellen           Abel            EABEL      011.44.1644.429267   11-MAY-96 SA_REP          11000             .3        103            80                                                     
        176 Jonathon        Taylor          JTAYLOR    011.44.1644.429265   24-MAR-98 SA_REP           9600             .3        149            80                                                     
        178 Kimerely        Grant           KGRANT     011.44.1644.429263   24-MAY-99 SA_REP           7000            .15        149                                                                   
        200 Jennifer        Whalen          JWHALEN    515.123.4444         17-SEP-87 AD_ASST          6600                       101            10                                                     
        201 Michael         Hartstein       MHARTSTE   515.123.5555         17-FEB-96 MK_MAN          15600                       100            20                                                     
        202 Pat             Fay             PFAY       603.123.6666         17-AUG-97 MK_REP          10800                       201            20                                                     
        205 Shelley         Higgins         SHIGGINS   515.123.8080         07-JUN-94 AC_MGR          12000                       101           110                                                     
        206 William         Gietz           WGIETZ     515.123.8181         07-JUN-94 SA_REP          11000                       100           110                                                     

20 rows selected.

SQL> REM CREATE TABLE E1 AS SELECT * FROM EMPLOYEES;
SQL> 
SQL> REM 1 COMPANY ANNOUNCE 1500 INCREMENT FOR EMPLOYEE 200
SQL> 
SQL> REM 2 COMPANY ANNOUNCE 1000 INCREMENT FOR ALL WHO WORKS AS IT_PROG
SQL> 
SQL> REM 3 COMPANY ANNOUNCE 20% INCREMENT FOR ALL WHO REPORTS TO 124
SQL> 
SQL> REM 4 COMPANY PROMOTS 149 TO SA_MAN
SQL> 
SQL> REM 5 FOR EMPLOYEE 149 COMPANY DECIDES TO PAY SALARY WHICH IS PAIS TO EMPLOYEE 205
SQL> 
SQL> REM 6 COMPANY DECIDES TO PAY .25 COMMISSIN TO ALL WHO WORKS IN DEPARTMENT 20
SQL> 
SQL> REM 7 COMPANY DECIDES TO PROMOTE EMPLOYEE 142 TO IT_PROG WITH 100% INCREMENT
SQL> 
SQL> REM 8 EMPLOYEE 205 WERE HIRED 1 MONTH EALIRER THAN RECORDS
SQL> 
SQL> REM 9 COMPANY NOW ONWARDS WILL NOT PAY ANY COMMISSION TO EMPLOYEE 149
SQL> 
SQL> REM 10 COMPANY DECIDES TO SAVE ALL FIRST_NAME IN CAPITAL AND LAST_NAME IN SMALL ALPHABETS.
SQL> 
SQL> 
SQL> 
SQL> REM 1 COMPANY ANNOUNCE 1500 INCREMENT FOR EMPLOYEE 200
SQL> 
SQL> UPDATE E1 SET SALARY = SALARY + 1500 WHERE EMPLOYEE_ID = 200;

1 row updated.

SQL> REM 2 COMPANY ANNOUNCE 1000 INCREMENT FOR ALL WHO WORKS AS IT_PROG
SQL> 
SQL> UPDATE E1 SET SALARY = SALARY + 1000 WHERE JOB_ID = 'IT_PROG';

3 rows updated.

SQL> REM 3 COMPANY ANNOUNCE 20% INCREMENT FOR ALL WHO REPORTS TO 124
SQL> 
SQL> UPDATE E1 SET SALARY = SALARY * 1.2 WHERE MANAGER_ID \ 124;
UPDATE E1 SET SALARY = SALARY * 1.2 WHERE MANAGER_ID \ 124
                                                     *
ERROR at line 1:
ORA-00911: invalid character 


SQL> UPDATE E1 SET SALARY = SALARY * 1.2 WHERE MANAGER_ID = 124;

4 rows updated.

SQL> REM 4 COMPANY PROMOTS 149 TO SA_MAN
SQL> 
SQL> UPDATE E1 SET JOB_ID = 'SA_MAN' WHERE EMPLOYEE_ID = 149;

1 row updated.

SQL> REM 5 FOR EMPLOYEE 149 COMPANY DECIDES TO PAY SALARY WHICH IS PAIS TO EMPLOYEE 205
SQL> 
SQL> UPDATE E1 SET SALARY = (SELECT SALARY FROM EMPLOYEES WHERE EMPLOYEE_ID = 205) WHERE EMPLOYEE_ID = 149;

1 row updated.

SQL> REM 6 COMPANY DECIDES TO PAY .25 COMMISSIN TO ALL WHO WORKS IN DEPARTMENT 20
SQL> 
SQL> UPDATE E1 SET COMMISION_PCT = .25 WHERE DEPARTMENT_ID = 20;
UPDATE E1 SET COMMISION_PCT = .25 WHERE DEPARTMENT_ID = 20
              *
ERROR at line 1:
ORA-00904: "COMMISION_PCT": invalid identifier 


SQL> UPDATE E1 SET COMMISSION_PCT = .25 WHERE DEPARTMENT_ID = 20;

2 rows updated.

SQL> REM 7 COMPANY DECIDES TO PROMOTE EMPLOYEE 142 TO IT_PROG WITH 100% INCREMENT
SQL> 
SQL> UPDATE E1 SET SALARY = SALARY * 2 WHERE EMPLOYEE_ID = 143;

1 row updated.

SQL> REM 8 EMPLOYEE 205 WERE HIRED 1 MONTH EALIRER THAN RECORDS
SQL> 
SQL> REM 7 COMPANY DECIDES TO PROMOTE EMPLOYEE 142 TO IT_PROG WITH 100% INCREMENT
SQL> 
SQL> UPDATE E1 SET SALARY = SALARY * 2 , JOB_ID = 'IT_PROG' WHERE EMPLOYEE_ID = 143;

1 row updated.

SQL> REM 8 EMPLOYEE 205 WERE HIRED 1 MONTH EALIRER THAN RECORDS
SQL> 
SQL> UPDATE SET E1 HIRE_DATE = ADD_MONTHS(HIRE_DATE,-1) WHERE EMPLOYEE_ID = 205;
UPDATE SET E1 HIRE_DATE = ADD_MONTHS(HIRE_DATE,-1) WHERE EMPLOYEE_ID = 205
       *
ERROR at line 1:
ORA-00903: invalid table name 


SQL> UPDATE E1 SET HIRE_DATE = ADD_MONTHS(HIRE_DATE,-1) WHERE EMPLOYEE_ID = 205;

1 row updated.

SQL> REM 9 COMPANY NOW ONWARDS WILL NOT PAY ANY COMMISSION TO EMPLOYEE 149
SQL> 
SQL> UPDATE E1 SET COMMISSION_PCT = NULL WHERE EMPLOYEE_ID = 149;

1 row updated.

SQL> REM 10 COMPANY DECIDES TO SAVE ALL FIRST_NAME IN CAPITAL AND LAST_NAME IN SMALL ALPHABETS.
SQL> 
SQL> UPDATE E1 SET FIRST_NAME = UPPER(FIRST_NAME) , LAST_NAME = LOWER(LAST_NAME);

20 rows updated.

SQL> SELECT * FROM EMPLOYEES;

EMPLOYEE_ID FIRST_NAME      LAST_NAME       EMAIL      PHONE_NUMBER         HIRE_DATE JOB_ID         SALARY COMMISSION_PCT MANAGER_ID DEPARTMENT_ID                                                     
----------- --------------- --------------- ---------- -------------------- --------- ---------- ---------- -------------- ---------- -------------                                                     
        100 Steven          King            SKING      515.123.4567         17-JUL-87 AD_PRES         24000                                      90                                                     
        101 Neena           Kochhar         NKOCHHAR   515.123.4568         21-SEP-89 AD_VP           17000                       100            90                                                     
        102 Lex             De Haan         LDEHAAN    515.123.4569         13-JAN-93 AD_VP           17000                       100            90                                                     
        103 Alexander       Hunold          AHUNOLD    590.423.4567         03-JAN-90 IT_PROG          9000                       102            60                                                     
        104 Bruce           Ernst           BERNST     590.423.4568         21-MAY-91 IT_PROG          6000                       103            60                                                     
        107 Diana           Lorentz         DLORENTZ   590.423.5567         07-FEB-99 IT_PROG          4200                       103            60                                                     
        124 Kevin           Mourgos         KMOURGOS   650.123.5234         16-NOV-99 ST_MAN           5800                       100            50                                                     
        141 Trenna          Rajs            TRAJS      650.121.8009         17-OCT-95 ST_CLERK         3500                       124            50                                                     
        142 Curtis          Davies          CDAVIES    650.121.2994         29-JAN-97 ST_CLERK         3100                       124            50                                                     
        143 Randall         Matos           RMATOS     650.121.2874         15-MAR-98 ST_CLERK         2600                       124            50                                                     
        144 Peter           Vargas                     650.121.2004         09-JUL-98 ST_CLERK         2500                       124            50                                                     
        149 Eleni           Zlotkey         EZLOTKEY   011.44.1344.429018   29-JAN-00 SA_MAN          10500             .2        100            80                                                     
        174 Ellen           Abel            EABEL      011.44.1644.429267   11-MAY-96 SA_REP          11000             .3        149            80                                                     
        176 Jonathon        Taylor          JTAYLOR    011.44.1644.429265   24-MAR-98 SA_REP           8600             .3        149            80                                                     
        178 Kimerely        Grant           KGRANT     011.44.1644.429263   24-MAY-99 SA_REP           7000            .15        149                                                                   
        200 Jennifer        Whalen          JWHALEN    515.123.4444         17-SEP-87 AD_ASST          4400                       101            10                                                     
        201 Michael         Hartstein       MHARTSTE   515.123.5555         17-FEB-96 MK_MAN          13000                       100            20                                                     
        202 Pat             Fay             PFAY       603.123.6666         17-AUG-97 MK_REP           6000                       201            20                                                     
        205 Shelley         Higgins         SHIGGINS   515.123.8080         07-JUN-94 AC_MGR          12000                       101           110                                                     
        206 William         Gietz           WGIETZ     515.123.8181         07-JUN-94 AC_ACCOUNT       8300                       205           110                                                     

20 rows selected.

SQL> REM COMPANY ANNOUNCE 10% INCREMENT FOR THOSE WHO WERE HIRED IN FIRST HALF OF ANY YEAR AND 20% TO REMAINING. (USING SINGLE UPDATE STAEMENT)
SQL> 
SQL> UPDATE E1 SET SALARY = SALARY * CASE WHEN TO_CHAR(HIRE_DATE,'MM') < 7 THEN 1.1 ELSE 1.2 END;

20 rows updated.

SQL> SPOOL OFF
